brand,model,market,currency,price,sales_volume_units,sales_volume_value,profit_margin_percent,demographics_primary_age,demographics_secondary_age,demographics_gender,demographics_income_bracket,notes
PUMA,King 20 Match FG/AG,UK,GBP,28.0,,,,,,,,Classic control line; UK deep discount; track stock constraints.
PUMA,King 20 Ultimate,US,USD,220.0,,,,,,,,Premium US SKU; good review context for comfort and balance.
Mizuno,Morelia Neo IV Beta MIJ FG,UK,GBP,250.0,,,,,,,,Premium leather boot; UK premium positioning.
Mizuno,Morelia Neo IV Beta AG,US,USD,320.0,,,,,,,,Premium US listing; track availability limits or regional restrictions.
New Balance,Tekela Elite FG V5,UK,GBP,126.0,,,,,,,,Discounted UK price; consider stock/seasonal restock.
New Balance,Tekela Elite FG V5,US,USD,,,,,,,,,Add US price once confirmed; track review sentiment.
Skechers,SKX 1 Firm Ground,UK,GBP,30.0,,,,,,,,New entrant; track strong discounting and availability.
Skechers,SKX line,US,USD,,,,,,,,,Add US SKU price; track comfort-focused demographics.
